"ja","en","vi"
"パソコンの具合が変です。ウイルスに感染しているみたいです。","There's something wrong with this PC. Maybe It has a virus.","Có điều gì đó sai với máy tính này. Có lẽ nó có bị nhiễm virus."
"ウイルスをスキャンする","detect viruses on your computer.","phát hiện virus trên máy tính của bạn."
"このＰＣはウイルスに感染している。","This computer is infected with a virus.","Máy tính này bị nhiễm một loại virus."
"私のパソコンがウイルスに感染した。","I've got a virus on my PC","Tôi đã có một virus trên máy tính của tôi"
"ウイルスに感染したファイル","A file infected with a virus.","Một tập tin bị nhiễm virus."
"ウイルスが入ったファイル","A file with a virus.","Một tập tin với một virus."
"アンチウイルスソフトでウイルスを駆除する。","clean up viruses with antivirus software.","làm sạch virus với phần mềm chống virus."
"何度試してもインターネットにつながりません。","I have tried hooking up to the Internet, but I can't.","Tôi đã cố gắng hooking lên Internet, nhưng tôi không thể."
"それは、パソコンの不具合でなくＩＳＰ側での問題だと思われます。","Maybe it is not a problem on your computer. There must be a server problem at your ISP.","Có lẽ nó không phải là một vấn đề trên máy tính của bạn. Có phải là một vấn đề máy chủ ISP của bạn."
"ページが文字化けしてしまいます。エンコードしても直りません。","It displays corrupted text and it can't be fixed although I used the function "encode".","Nó hiển thị văn bản bị hỏng và nó không thể được cố định mặc dù tôi đã sử dụng chức năng "mã hóa"."
"OSが日本語でないので、しかたないのかもしれませｎ。","Maybe it can not be helped. The OS is not a Japanese one.","Có lẽ nó không thể được giúp đỡ. Các hệ điều hành không phải là một người Nhật."
"共有パソコンだから、使い終わったら（帰る前に）キャッシュと履歴をクリアにした方がいいよ。","As this is a shared computer, you'd better clear the cache and the history before you leave.","Vì đây là một máy tính dùng chung, bạn nên xóa cache và lịch sử trước khi bạn rời đi."
"履歴はどうやって削除するの？","How do I clear the history?","Làm thế nào để xóa lịch sử?"
"メニューからオプションを選択して表示されたダイアログにある「履歴をクリア」をクリックすれば削除できるよ。","Select Option from the menu, and then, click on "Clear the history" on the dialog box appeared.","Chọn Lựa chọn từ trình đơn, và sau đó, nhấp vào "Xóa lịch sử" trên hộp thoại xuất hiện."
"同じやり方でキャッシュもクリアできるよ。","You can clear cache with the same way.","Bạn có thể xóa bộ nhớ cache với cùng một cách."
